[{"answer":{"optionId":"A","type":"choice_single"},"constraints":["A service endpoint extends a subnet's identity to a supported Azure service over the Azure backbone; the service still uses its public endpoint and DNS name.","Enable the endpoint on the client subnet and configure the resource firewall; do not treat it as a private IP deployment."],"difficulty":null,"feedback":{"details":{"boundaryOrTradeoff":"A service endpoint extends a subnet's identity to a supported Azure service over the Azure backbone; the service still uses its public endpoint and DNS name.","errorCorrection":"The route optimization alone does not deny other origins. The subnet identity must be enabled for the virtual-network rule design. That couples access to public egress rather than the approved subnet identity.","mechanismOrProperty":"The endpoint supplies subnet identity to Storage, and the resource firewall admits that selected origin.","scenarioApplication":"Enable the Microsoft.Storage service endpoint on the client subnet and add that subnet to the storage account network rules.","transfer":"Enable the endpoint on the client subnet and configure the resource firewall; do not treat it as a private IP deployment.","url":"https://learn.microsoft.com/en-us/azure/virtual-network/virtual-network-service-endpoints-overview"},"messages":[{"kind":"wrong_option","targetId":"B","text":"The route optimization alone does not deny other origins."},{"kind":"wrong_option","targetId":"C","text":"The subnet identity must be enabled for the virtual-network rule design."},{"kind":"wrong_option","targetId":"D","text":"That couples access to public egress rather than the approved subnet identity."}],"reason":"The endpoint supplies subnet identity to Storage, and the resource firewall admits that selected origin.","type":"choice_single"},"interaction":{"options":[{"optionId":"A","text":"Enable the Microsoft.Storage service endpoint on the client subnet and add that subnet to the storage account network rules."},{"optionId":"B","text":"Create only the service endpoint and leave Storage network access unrestricted."},{"optionId":"C","text":"Add only a storage firewall subnet rule without enabling its required endpoint path."},{"optionId":"D","text":"Create a public IP on every VM and allow those addresses."}],"scoringMethod":"exact_selected_set","type":"choice_single"},"mentalUnitId":"AZ104-N08-B04","nodeId":"azure_network_security_private_access_and_load_balancing","prompt":"VMs in one subnet must access Azure Storage over the Azure backbone while the account denies other VNet origins. Which design fits?","questionId":"az104-AZ104-N08-B04-001","sourceRefs":["microsoft-az-104-study-guide","service-endpoints"],"trackId":"microsoft-azure-administrator-associate-az-104"},{"answer":{"optionId":"D","type":"choice_single"},"constraints":["A service endpoint extends a subnet's identity to a supported Azure service over the Azure backbone; the service still uses its public endpoint and DNS name.","Enable the endpoint on the client subnet and configure the resource firewall; do not treat it as a private IP deployment."],"difficulty":null,"feedback":{"details":{"boundaryOrTradeoff":"A service endpoint extends a subnet's identity to a supported Azure service over the Azure backbone; the service still uses its public endpoint and DNS name.","errorCorrection":"A private endpoint introduces a private IP and is a different access model. ASGs group workload NICs for NSGs and are not generic PaaS firewall operands. DNS endpoint selection does not enforce source-network admission.","mechanismOrProperty":"Service endpoints preserve the service's public endpoint while allowing subnet-scoped admission over the Azure backbone.","scenarioApplication":"Use a supported virtual network service endpoint plus resource-side virtual network firewall rules.","transfer":"Enable the endpoint on the client subnet and configure the resource firewall; do not treat it as a private IP deployment.","url":"https://learn.microsoft.com/en-us/azure/virtual-network/virtual-network-service-endpoints-overview"},"messages":[{"kind":"wrong_option","targetId":"A","text":"A private endpoint introduces a private IP and is a different access model."},{"kind":"wrong_option","targetId":"B","text":"ASGs group workload NICs for NSGs and are not generic PaaS firewall operands."},{"kind":"wrong_option","targetId":"C","text":"DNS endpoint selection does not enforce source-network admission."}],"reason":"Service endpoints preserve the service's public endpoint while allowing subnet-scoped admission over the Azure backbone.","type":"choice_single"},"interaction":{"options":[{"optionId":"A","text":"Use Private Link and require the service to keep only a public IP."},{"optionId":"B","text":"Use an ASG as the PaaS firewall identity."},{"optionId":"C","text":"Use Traffic Manager to authorize subnets."},{"optionId":"D","text":"Use a supported virtual network service endpoint plus resource-side virtual network firewall rules."}],"scoringMethod":"exact_selected_set","type":"choice_single"},"mentalUnitId":"AZ104-N08-B04","nodeId":"azure_network_security_private_access_and_load_balancing","prompt":"A PaaS resource must retain its public endpoint but accept traffic only from selected Azure subnets. Which feature should be considered?","questionId":"az104-AZ104-N08-B04-002","sourceRefs":["microsoft-az-104-study-guide","service-endpoints"],"trackId":"microsoft-azure-administrator-associate-az-104"},{"answer":{"optionId":"C","type":"choice_single"},"constraints":["Service endpoint policies restrict supported service traffic from a subnet to allowed Azure resource destinations; they do not create inbound private endpoints.","Associate a policy only after validating supported services and resources, then preserve other required service destinations."],"difficulty":null,"feedback":{"details":{"boundaryOrTradeoff":"Service endpoint policies restrict supported service traffic from a subnet to allowed Azure resource destinations; they do not create inbound private endpoints.","errorCorrection":"DNS omission is not a secure destination authorization control. The accounts are managed service destinations, not backends of the customer's Load Balancer. PaaS storage resources are not members of customer ASGs.","mechanismOrProperty":"The policy narrows service-endpoint egress from the subnet to listed supported resources.","scenarioApplication":"Associate a supported service endpoint policy that allows the approved Storage resource destinations.","transfer":"Associate a policy only after validating supported services and resources, then preserve other required service destinations.","url":"https://learn.microsoft.com/en-us/azure/virtual-network/virtual-network-service-endpoint-policies-overview"},"messages":[{"kind":"wrong_option","targetId":"A","text":"DNS omission is not a secure destination authorization control."},{"kind":"wrong_option","targetId":"B","text":"The accounts are managed service destinations, not backends of the customer's Load Balancer."},{"kind":"wrong_option","targetId":"D","text":"PaaS storage resources are not members of customer ASGs."}],"reason":"The policy narrows service-endpoint egress from the subnet to listed supported resources.","type":"choice_single"},"interaction":{"options":[{"optionId":"A","text":"Create a private DNS zone with only two account records."},{"optionId":"B","text":"Use an inbound Load Balancer rule for the two accounts."},{"optionId":"C","text":"Associate a supported service endpoint policy that allows the approved Storage resource destinations."},{"optionId":"D","text":"Add an NSG destination ASG containing the Storage accounts."}],"scoringMethod":"exact_selected_set","type":"choice_single"},"mentalUnitId":"AZ104-N08-B04","nodeId":"azure_network_security_private_access_and_load_balancing","prompt":"A subnet may reach only two approved Storage accounts through its Microsoft.Storage endpoint. What additional control fits?","questionId":"az104-AZ104-N08-B04-003","sourceRefs":["microsoft-az-104-study-guide","service-endpoint-policies"],"trackId":"microsoft-azure-administrator-associate-az-104"},{"answer":{"optionId":"B","type":"choice_single"},"constraints":["Storage network rules can admit selected subnets using service endpoints while denying other network origins.","Enable the correct Storage service endpoint, add the subnet rule, and test from the intended source after propagation."],"difficulty":null,"feedback":{"details":{"boundaryOrTradeoff":"Storage network rules can admit selected subnets using service endpoints while denying other network origins.","errorCorrection":"The supported firewall rule is scoped to a subnet resource. A managed Storage account cannot have the customer's subnet NSG attached to it. That assigns identity to the wrong origin.","mechanismOrProperty":"Storage network rules evaluate selected subnet identities, allowing separation within one VNet.","scenarioApplication":"Enable the Storage service endpoint on the application subnet and add only that subnet as a storage virtual network rule.","transfer":"Enable the correct Storage service endpoint, add the subnet rule, and test from the intended source after propagation.","url":"https://learn.microsoft.com/en-us/azure/storage/common/storage-network-security"},"messages":[{"kind":"wrong_option","targetId":"A","text":"The supported firewall rule is scoped to a subnet resource."},{"kind":"wrong_option","targetId":"C","text":"A managed Storage account cannot have the customer's subnet NSG attached to it."},{"kind":"wrong_option","targetId":"D","text":"That assigns identity to the wrong origin."}],"reason":"Storage network rules evaluate selected subnet identities, allowing separation within one VNet.","type":"choice_single"},"interaction":{"options":[{"optionId":"A","text":"Add the VNet resource ID without a subnet selection."},{"optionId":"B","text":"Enable the Storage service endpoint on the application subnet and